{
  "oscillators": [
    {"waveform": "saw", "detune_cents": 6, "semi_offset": 0, "level": 0.7},
    {"waveform": "saw", "detune_cents": -6, "semi_offset": 0, "level": 0.65}
  ],
  "filter": {"type": "ladder_lp", "cutoff_hz": 1600, "resonance": 0.22, "drive": 0.2},
  "env": {
    "amp": {"attack_ms": 900, "decay_ms": 600, "sustain": 0.78, "release_ms": 1800}
  },
  "lfo": [
    {"rate_hz": 0.35, "shape": "sine", "targets": [{"param": "filter.cutoff_hz", "depth": 0.25}]}
  ],
  "fx": {
    "reverb": {"mix": 0.28}
  },
  "meta": {
    "bpm": 120,
    "seed": 42,
    "model": "offline-rule",
    "temperature": 0.6
  }
}
